Name,Designation,Email,Research Topics
Prof. Adel S. Al-Malaise Al-Ghamdi,Dean,aagmald@kau.edu.sa,Information Security
Dr. Mohammed S. Al-Kahtani,Vice Dean,mskahtani@kau.edu.sa,Cybersecurity
Dr. Fahad Alshahrani,Faculty Member,falshahrani1@kau.edu.sa,"Artificial Intelligence, Machine Learning"
Dr. Hossam Faris,Faculty Member,hossam.faris@kau.edu.sa,"Machine Learning, Bioinformatics"
Dr. Abdullah Alharbi,Faculty Member,ab.alharbi@kau.edu.sa,Network Security
Dr. Manal Alruily,Faculty Member,malruily@kau.edu.sa,"Data Science, Natural Language Processing"
Dr. Waleed Alasmary,Faculty Member,walsmary@kau.edu.sa,"Cloud Computing, Distributed Systems"
Dr. Mohammed Aljohani,Faculty Member,maljohani@kau.edu.sa,"Computer Vision, Image Processing"
Dr. Sultan Alotaibi,Faculty Member,salotaibi@kau.edu.sa,"Wireless Networks, Mobile Computing"
